{
  "profile": "ualf-index/v1",
  "source": {
    "path": "example-trajectory.jsonl",
    "sha256": "7f4a640390689408230b251ac5ca838b1b731face9f331dab140a482229dede8",
    "bytes": 22062
  },
  "created_at": "2026-08-03T12:00:00Z",
  "generator": {
    "name": "build_profiles.py",
    "version": "1.0.0"
  },
  "records": [
    {
      "seq": 1,
      "kind": "header",
      "offset": 0,
      "length": 2612,
      "sha256": "9b243587db51305f5be9a1c975e8257b5f41681eab0b04f6171fa920a24afb3a"
    },
    {
      "seq": 2,
      "kind": "event",
      "offset": 2613,
      "length": 733,
      "sha256": "e16f29304ddcf59ff9855008298a636555bc959fa132f20a56576e0d0d632635",
      "event_id": "evt-agent-start",
      "event_type": "agent.started"
    },
    {
      "seq": 3,
      "kind": "event",
      "offset": 3347,
      "length": 778,
      "sha256": "f7f1f38f556e1e59580396ac6251cfee8e2adac19920acc3010be1a66267a03a",
      "event_id": "evt-run-observation",
      "event_type": "observation.received"
    },
    {
      "seq": 4,
      "kind": "event",
      "offset": 4126,
      "length": 949,
      "sha256": "3d6ec40fb79a08fc53652c0579e010ee610d769d98b526ace115acc263fce4aa",
      "event_id": "evt-test-start-1",
      "event_type": "tool_call.started"
    },
    {
      "seq": 5,
      "kind": "event",
      "offset": 5076,
      "length": 1064,
      "sha256": "35643c4f0a99a09b6eec831437e75645c5070ef47495b2da5136b05819f464d5",
      "event_id": "evt-test-end-1",
      "event_type": "tool_call.completed"
    },
    {
      "seq": 6,
      "kind": "event",
      "offset": 6141,
      "length": 740,
      "sha256": "0a9f048886b2075fa631557d8c1d4dc93d0ea1bced9577a40b6c17f00066be6d",
      "event_id": "evt-test-error",
      "event_type": "error.recorded"
    },
    {
      "seq": 7,
      "kind": "event",
      "offset": 6882,
      "length": 2023,
      "sha256": "c9ee7d52325975cd2b271ccea59e46da539b14f93a58a6709e9602900932f801",
      "event_id": "evt-model-start",
      "event_type": "model_call.started"
    },
    {
      "seq": 8,
      "kind": "event",
      "offset": 8906,
      "length": 1181,
      "sha256": "baf2ac0959cba6d589a60b6658e33af5f0a9ceffdbadd806f467e7278eb63c0e",
      "event_id": "evt-model-end",
      "event_type": "model_call.completed"
    },
    {
      "seq": 9,
      "kind": "event",
      "offset": 10088,
      "length": 1138,
      "sha256": "8785b833a66f07dc58aebb2f12ba20e9c65d126a7d9b805cb7616e62f0e23c81",
      "event_id": "evt-decision",
      "event_type": "decision.recorded"
    },
    {
      "seq": 10,
      "kind": "event",
      "offset": 11227,
      "length": 904,
      "sha256": "a1278be1f7b7a1c7c71172cd1ff6b2459ac40a78ecba66b039cd2918bdb12caa",
      "event_id": "evt-read-start",
      "event_type": "tool_call.started"
    },
    {
      "seq": 11,
      "kind": "event",
      "offset": 12132,
      "length": 1149,
      "sha256": "3e846444926f37c0f51a2a23077647234b12a6a0e381e3ca0d651ef8c72cefed",
      "event_id": "evt-read-end",
      "event_type": "tool_call.completed"
    },
    {
      "seq": 12,
      "kind": "event",
      "offset": 13282,
      "length": 1011,
      "sha256": "6ad90f8f162fb069c3cb342d5845a9cf966ec147955a3b3d2fa0536f25bed554",
      "event_id": "evt-edit-start",
      "event_type": "tool_call.started"
    },
    {
      "seq": 13,
      "kind": "event",
      "offset": 14294,
      "length": 856,
      "sha256": "4b99758bb3c5d71ecbea1c69e405c5f119039d93377e94b560c8badbcbee1044",
      "event_id": "evt-edit-end",
      "event_type": "tool_call.completed"
    },
    {
      "seq": 14,
      "kind": "event",
      "offset": 15151,
      "length": 1170,
      "sha256": "fb6377984ef8fa9b16b1d8edf9dab2de940c9006ba7737071dcbaf2b120f7bd6",
      "event_id": "evt-file-change",
      "event_type": "file_change.recorded"
    },
    {
      "seq": 15,
      "kind": "event",
      "offset": 16322,
      "length": 793,
      "sha256": "c2260dfa673099849c48c3da1c8c2c265656995d1bc53b3a17697105ec4c8b64",
      "event_id": "evt-retry",
      "event_type": "retry.started"
    },
    {
      "seq": 16,
      "kind": "event",
      "offset": 17116,
      "length": 893,
      "sha256": "2edb8f47e2e636966778162cea10ca8490d046770413bd8ee4944fa11785781f",
      "event_id": "evt-test-start-2",
      "event_type": "tool_call.started"
    },
    {
      "seq": 17,
      "kind": "event",
      "offset": 18010,
      "length": 870,
      "sha256": "936365ad39994b1a563ab2c5bee5b85458c0447ad93fa5b94c6a9fdccbae5741",
      "event_id": "evt-test-end-2",
      "event_type": "tool_call.completed"
    },
    {
      "seq": 18,
      "kind": "event",
      "offset": 18881,
      "length": 768,
      "sha256": "3f204f66045b3edb10bcec836392d95fa8e1bab8db64ba4317aa21fbc02f088a",
      "event_id": "evt-agent-complete",
      "event_type": "agent.completed"
    },
    {
      "seq": 19,
      "kind": "event",
      "offset": 19650,
      "length": 1077,
      "sha256": "d2536b97b2d0180eda344c54391d12dd67effdb19419e7a225e9ebff0d2ce417",
      "event_id": "evt-evaluation",
      "event_type": "evaluation.completed"
    },
    {
      "seq": 20,
      "kind": "outcome",
      "offset": 20728,
      "length": 1333,
      "sha256": "82284c087e1beda30a9c92a8c6b3dcc61e63b7148c540e953cc37e742056d436"
    }
  ]
}
